[{"id":"event-0001","date":"April 26, 1995","date_certainty":"exact","description":"The condominium declaration and C of O No. 107294 were issued for 13 Harrison Street.","event_type":"communication","proceeding_id":null,"related_claim_ids":[],"related_evidence_ids":[],"related_entity_ids":["entity-0025"],"causal_tags":[],"notes_internal":null},{"id":"event-0002","date":"2007","date_certainty":"exact","description":"Michael and Alexis Bleich purchased Unit 1.","event_type":"transaction","proceeding_id":"proc-0002","related_claim_ids":["claim-0021"],"related_evidence_ids":["evidence-0017"],"related_entity_ids":["entity-0002","entity-0026"],"causal_tags":[],"notes_internal":null},{"id":"event-0003","date":"2008","date_certainty":"exact","description":"Morgan Brill purchased Unit 2 and replaced all HVAC systems.","event_type":"transaction","proceeding_id":null,"related_claim_ids":["claim-0001","claim-0002","claim-0003","claim-0004","claim-0005","claim-0006","claim-0007"],"related_evidence_ids":["evidence-0003","evidence-0004","evidence-0005"],"related_entity_ids":["entity-0005","entity-0027"],"causal_tags":[],"notes_internal":null},{"id":"event-0004","date":"March 1, 2017","date_certainty":"exact","description":"Bleich signed an exclusive right-to-sell agreement with BHS at $6 million.","event_type":"communication","proceeding_id":"proc-0002","related_claim_ids":["claim-0021"],"related_evidence_ids":["evidence-0017"],"related_entity_ids":[],"causal_tags":[],"notes_internal":null},{"id":"event-0005","date":"June 1, 2017","date_certainty":"exact","description":"Unit 1 was publicly listed on StreetEasy at $6,500,000.","event_type":"communication","proceeding_id":null,"related_claim_ids":[],"related_evidence_ids":[],"related_entity_ids":["entity-0026"],"causal_tags":[],"notes_internal":null},{"id":"event-0006","date":"August 24, 2018","date_certainty":"exact","description":"Morgan Brill entered into a contract to sell Unit 2 to Towne 1031 Exchange.","event_type":"communication","proceeding_id":null,"related_claim_ids":["claim-0001","claim-0002","claim-0003","claim-0004","claim-0005","claim-0006","claim-0007"],"related_evidence_ids":["evidence-0003","evidence-0004","evidence-0005"],"related_entity_ids":["entity-0005","entity-0027"],"causal_tags":[],"notes_internal":null},{"id":"event-0007","date":"September 16, 2018","date_certainty":"exact","description":"Compass exclusive agreement signed for Unit 1 at $4,500,000.","event_type":"communication","proceeding_id":"proc-0002","related_claim_ids":["claim-0022","claim-0025","claim-0026"],"related_evidence_ids":["evidence-0034"],"related_entity_ids":["entity-0026"],"causal_tags":[],"notes_internal":null},{"id":"event-0008","date":"September 17, 2018","date_certainty":"exact","description":"Kornmeier was fired after telling Bleich the price was too high because the unit was half basement.","event_type":"communication","proceeding_id":null,"related_claim_ids":["claim-0015","claim-0016","claim-0017","claim-0021"],"related_evidence_ids":["evidence-0012","evidence-0017"],"related_entity_ids":[],"causal_tags":[],"notes_internal":null},{"id":"event-0009","date":"October 15, 2018","date_certainty":"exact","description":"Purported board meeting took place and later-minuted actions were recorded.","event_type":"communication","proceeding_id":null,"related_claim_ids":["claim-0036","claim-0037"],"related_evidence_ids":["evidence-0001","evidence-0030"],"related_entity_ids":[],"causal_tags":[],"notes_internal":null},{"id":"event-0010","date":"October 17, 2018","date_certainty":"exact","description":"ROFR waiver certificates were issued.","event_type":"communication","proceeding_id":null,"related_claim_ids":["claim-0002"],"related_evidence_ids":["evidence-0002"],"related_entity_ids":[],"causal_tags":[],"notes_internal":null},{"id":"event-0011","date":"October 18, 2018","date_certainty":"exact","description":"Closing of the Unit 2 sale occurred.","event_type":"transaction","proceeding_id":null,"related_claim_ids":[],"related_evidence_ids":[],"related_entity_ids":["entity-0027"],"causal_tags":[],"notes_internal":null},{"id":"event-0012","date":"October 19, 2018","date_certainty":"exact","description":"Morgan Brill sent her resignation email.","event_type":"communication","proceeding_id":null,"related_claim_ids":["claim-0001","claim-0002","claim-0003","claim-0004","claim-0005","claim-0006","claim-0007","claim-0009","claim-0010","claim-0011","claim-0012","claim-0013","claim-0014","claim-0032"],"related_evidence_ids":["evidence-0003","evidence-0004","evidence-0005","evidence-0006","evidence-0007","evidence-0010","evidence-0026"],"related_entity_ids":["entity-0005"],"causal_tags":[],"notes_internal":null}]