[{"id":"event-0036","date":"February 3, 2025","date_certainty":"exact","description":"Bleich orally admitted he supplements with other wall units.","event_type":"communication","proceeding_id":"proc-0002","related_claim_ids":["claim-0021"],"related_evidence_ids":["evidence-0017"],"related_entity_ids":[],"causal_tags":[],"notes_internal":null},{"id":"event-0037","date":"May 24, 2025","date_certainty":"exact","description":"Bleich sent the valuation spreadsheet and $6\u20138 million demand.","event_type":"communication","proceeding_id":null,"related_claim_ids":["claim-0021","claim-0030","claim-0031"],"related_evidence_ids":["evidence-0017","evidence-0025"],"related_entity_ids":[],"causal_tags":["post_injunction"],"notes_internal":null},{"id":"event-0038","date":"August 27, 2025","date_certainty":"exact","description":"The victim emailed counsel about changing the permit and concluding matters.","event_type":"communication","proceeding_id":null,"related_claim_ids":["claim-0007","claim-0009","claim-0010","claim-0011","claim-0012","claim-0013","claim-0014","claim-0032"],"related_evidence_ids":["evidence-0005","evidence-0006","evidence-0007","evidence-0010","evidence-0026"],"related_entity_ids":[],"causal_tags":["post_injunction"],"notes_internal":null},{"id":"event-0039","date":"September 26, 2025","date_certainty":"exact","description":"The Term Sheet (Final Draft) was transmitted.","event_type":"demand","proceeding_id":"proc-0003","related_claim_ids":["claim-0030","claim-0031"],"related_evidence_ids":["evidence-0025"],"related_entity_ids":[],"causal_tags":["post_injunction","settlement_pressure_sequence"],"notes_internal":null},{"id":"event-0040","date":"November 6\u20137, 2025","date_certainty":"exact","description":"NY Brownstone technicians inspected the rooftop equipment and found it non-functional.","event_type":"inspection","proceeding_id":"proc-0002","related_claim_ids":["claim-0021","claim-0022","claim-0025","claim-0026"],"related_evidence_ids":["evidence-0036"],"related_entity_ids":[],"causal_tags":["post_injunction"],"notes_internal":null},{"id":"event-0041","date":"late 2025","date_certainty":"approximate","description":"The 2025 action was commenced seeking counter-injunctive relief.","event_type":"filing","proceeding_id":null,"related_claim_ids":[],"related_evidence_ids":[],"related_entity_ids":[],"causal_tags":[],"notes_internal":null},{"id":"event-0042","date":"January 7, 2026","date_certainty":"exact","description":"Justice Kim signed OSC restraining cellar residential use.","event_type":"filing","proceeding_id":null,"related_claim_ids":["claim-0018","claim-0019","claim-0024"],"related_evidence_ids":["evidence-0013","evidence-0019","evidence-0028"],"related_entity_ids":[],"causal_tags":[],"notes_internal":null},{"id":"event-0043","date":"early 2026","date_certainty":"approximate","description":"The owner of Unit 2 retained Adam Leitman Bailey, P.C.","event_type":"communication","proceeding_id":null,"related_claim_ids":[],"related_evidence_ids":[],"related_entity_ids":["entity-0012","entity-0027"],"causal_tags":[],"notes_internal":null},{"id":"event-0044","date":"early 2026","date_certainty":"approximate","description":"The new action under Index No. 152171/2026 was commenced.","event_type":"filing","proceeding_id":"proc-0004","related_claim_ids":[],"related_evidence_ids":[],"related_entity_ids":[],"causal_tags":[],"notes_internal":null},{"id":"event-0045","date":"February 26, 2026","date_certainty":"exact","description":"Elcherbini issued his expert letter.","event_type":"communication","proceeding_id":null,"related_claim_ids":["claim-0021","claim-0022","claim-0025","claim-0026","claim-0045","claim-0046"],"related_evidence_ids":["evidence-0037"],"related_entity_ids":[],"causal_tags":[],"notes_internal":null},{"id":"event-0046","date":"March 2, 2026","date_certainty":"exact","description":"Vogt provided her sworn affirmation.","event_type":"communication","proceeding_id":"proc-0002","related_claim_ids":["claim-0021","claim-0022","claim-0023","claim-0025","claim-0026","claim-0044"],"related_evidence_ids":["evidence-0017","evidence-0018","evidence-0038","evidence-0039"],"related_entity_ids":[],"causal_tags":[],"notes_internal":null}]