[{"id":"event-0025","date":"March 4, 2019","date_certainty":"exact","description":"A $3.4 million offer was conveyed and refused.","event_type":"communication","proceeding_id":null,"related_claim_ids":[],"related_evidence_ids":[],"related_entity_ids":[],"causal_tags":[],"notes_internal":null},{"id":"event-0026","date":"July 7, 2019","date_certainty":"exact","description":"Bleich reported a water leak from Unit 2.","event_type":"communication","proceeding_id":"proc-0002","related_claim_ids":["claim-0021","claim-0027"],"related_evidence_ids":["evidence-0017","evidence-0021"],"related_entity_ids":["entity-0027"],"causal_tags":[],"notes_internal":null},{"id":"event-0027","date":"September 5, 2019","date_certainty":"exact","description":"Kornmeier deposition was taken.","event_type":"communication","proceeding_id":"proc-0001","related_claim_ids":["claim-0015","claim-0016","claim-0017"],"related_evidence_ids":["evidence-0012"],"related_entity_ids":[],"causal_tags":[],"notes_internal":null},{"id":"event-0028","date":"December 20, 2019","date_certainty":"exact","description":"Bowery appraisal valued Unit 1 at $2.5 million.","event_type":"transaction","proceeding_id":"proc-0001","related_claim_ids":["claim-0013"],"related_evidence_ids":["evidence-0011"],"related_entity_ids":["entity-0026"],"causal_tags":[],"notes_internal":null},{"id":"event-0029","date":"June 29, 2021","date_certainty":"exact","description":"Justice Perry issued his decision and order.","event_type":"ruling","proceeding_id":null,"related_claim_ids":["claim-0018","claim-0019","claim-0020","claim-0024"],"related_evidence_ids":["evidence-0013","evidence-0014","evidence-0019","evidence-0028"],"related_entity_ids":[],"causal_tags":[],"notes_internal":null},{"id":"event-0030","date":"April 30, 2021","date_certainty":"exact","description":"Bleich sent WhatsApp settlement messages.","event_type":"communication","proceeding_id":null,"related_claim_ids":["claim-0021","claim-0033","claim-0034"],"related_evidence_ids":["evidence-0017","evidence-0027"],"related_entity_ids":[],"causal_tags":[],"notes_internal":null},{"id":"event-0031","date":"May 24, 2022","date_certainty":"exact","description":"The First Department affirmed in part and reversed in part.","event_type":"ruling","proceeding_id":"proc-0001","related_claim_ids":["claim-0020"],"related_evidence_ids":["evidence-0014"],"related_entity_ids":[],"causal_tags":[],"notes_internal":null},{"id":"event-0032","date":"September 15, 2022","date_certainty":"exact","description":"At conference, Giacovas acknowledged cellar bedrooms and sleeping use.","event_type":"communication","proceeding_id":"proc-0001","related_claim_ids":[],"related_evidence_ids":["evidence-0015"],"related_entity_ids":[],"causal_tags":[],"notes_internal":null},{"id":"event-0033","date":"June 2024","date_certainty":"exact","description":"Workers erected concealment sheetrock/cardboard before DOB inspection.","event_type":"inspection","proceeding_id":null,"related_claim_ids":["claim-0021","claim-0022","claim-0025","claim-0026","claim-0030","claim-0031"],"related_evidence_ids":["evidence-0001","evidence-0022","evidence-0025","evidence-0036"],"related_entity_ids":[],"causal_tags":[],"notes_internal":null},{"id":"event-0034","date":"June 21, 2024","date_certainty":"exact","description":"The 2024 complaint and PI motion were filed.","event_type":"filing","proceeding_id":null,"related_claim_ids":["claim-0035"],"related_evidence_ids":["evidence-0008","evidence-0016","evidence-0029"],"related_entity_ids":[],"causal_tags":["pre_injunction"],"notes_internal":null},{"id":"event-0035","date":"January 17, 2025","date_certainty":"exact","description":"Justice Rosado granted the preliminary injunction.","event_type":"ruling","proceeding_id":null,"related_claim_ids":["claim-0018","claim-0019","claim-0024"],"related_evidence_ids":["evidence-0013","evidence-0019","evidence-0028"],"related_entity_ids":[],"causal_tags":["post_injunction"],"notes_internal":null}]