[{"id":"event-0013","date":"October 21, 2018","date_certainty":"exact","description":"Bleich sent a terse welcome email to Arnulf.","event_type":"communication","proceeding_id":null,"related_claim_ids":["claim-0007","claim-0009","claim-0010","claim-0011","claim-0012","claim-0013","claim-0014","claim-0021","claim-0032"],"related_evidence_ids":["evidence-0005","evidence-0006","evidence-0007","evidence-0010","evidence-0017","evidence-0026"],"related_entity_ids":[],"causal_tags":[],"notes_internal":null},{"id":"event-0014","date":"October 30, 2018","date_certainty":"exact","description":"The new owner proposed a personal meeting.","event_type":"communication","proceeding_id":null,"related_claim_ids":[],"related_evidence_ids":[],"related_entity_ids":[],"causal_tags":[],"notes_internal":null},{"id":"event-0015","date":"November 1, 2018","date_certainty":"exact","description":"Bleich agreed to meet on November 7 at Sarabeth\u2019s.","event_type":"communication","proceeding_id":"proc-0002","related_claim_ids":["claim-0021"],"related_evidence_ids":["evidence-0017"],"related_entity_ids":[],"causal_tags":[],"notes_internal":null},{"id":"event-0016","date":"November 7, 2018","date_certainty":"exact","description":"The in-person meeting at Sarabeth\u2019s occurred.","event_type":"communication","proceeding_id":null,"related_claim_ids":[],"related_evidence_ids":[],"related_entity_ids":[],"causal_tags":[],"notes_internal":null},{"id":"event-0017","date":"November 15, 2018","date_certainty":"exact","description":"Bleich sent the $15 million building sale pitch.","event_type":"communication","proceeding_id":"proc-0002","related_claim_ids":["claim-0021"],"related_evidence_ids":["evidence-0017"],"related_entity_ids":[],"causal_tags":[],"notes_internal":null},{"id":"event-0018","date":"November 20, 2018","date_certainty":"exact","description":"The Unit 2 owner requested a formal meeting of unit owners.","event_type":"communication","proceeding_id":null,"related_claim_ids":[],"related_evidence_ids":[],"related_entity_ids":["entity-0027"],"causal_tags":[],"notes_internal":null},{"id":"event-0019","date":"November 22, 2018","date_certainty":"exact","description":"Bleich sent Thanksgiving Day deflection email.","event_type":"communication","proceeding_id":null,"related_claim_ids":["claim-0007","claim-0009","claim-0010","claim-0011","claim-0012","claim-0013","claim-0014","claim-0021","claim-0032"],"related_evidence_ids":["evidence-0005","evidence-0006","evidence-0007","evidence-0010","evidence-0017","evidence-0026"],"related_entity_ids":[],"causal_tags":[],"notes_internal":null},{"id":"event-0020","date":"November 26, 2018","date_certainty":"exact","description":"Bleich refused to hold an official unit holders meeting.","event_type":"obstruction","proceeding_id":"proc-0002","related_claim_ids":["claim-0021"],"related_evidence_ids":["evidence-0017"],"related_entity_ids":[],"causal_tags":[],"notes_internal":null},{"id":"event-0021","date":"December 1, 2018","date_certainty":"exact","description":"Bleich sent the prophetic HVAC/commercial conversion email.","event_type":"communication","proceeding_id":null,"related_claim_ids":["claim-0007","claim-0009","claim-0010","claim-0011","claim-0012","claim-0013","claim-0014","claim-0021","claim-0032"],"related_evidence_ids":["evidence-0005","evidence-0006","evidence-0007","evidence-0010","evidence-0017","evidence-0026"],"related_entity_ids":[],"causal_tags":[],"notes_internal":null},{"id":"event-0022","date":"December 11, 2018","date_certainty":"exact","description":"Morgan Brill emailed corroboration that a new meeting was needed.","event_type":"communication","proceeding_id":null,"related_claim_ids":["claim-0001","claim-0002","claim-0003","claim-0004","claim-0005","claim-0006","claim-0007","claim-0009","claim-0010","claim-0011","claim-0012","claim-0013","claim-0014","claim-0032"],"related_evidence_ids":["evidence-0003","evidence-0004","evidence-0005","evidence-0006","evidence-0007","evidence-0010","evidence-0026"],"related_entity_ids":["entity-0005"],"causal_tags":[],"notes_internal":null},{"id":"event-0023","date":"February 26, 2019","date_certainty":"exact","description":"The 2019 action was commenced.","event_type":"filing","proceeding_id":null,"related_claim_ids":[],"related_evidence_ids":[],"related_entity_ids":[],"causal_tags":[],"notes_internal":null},{"id":"event-0024","date":"February 28, 2019","date_certainty":"exact","description":"Bleich sent his post-filing email.","event_type":"communication","proceeding_id":null,"related_claim_ids":["claim-0007","claim-0009","claim-0010","claim-0011","claim-0012","claim-0013","claim-0014","claim-0021","claim-0032"],"related_evidence_ids":["evidence-0005","evidence-0006","evidence-0007","evidence-0010","evidence-0017","evidence-0026"],"related_entity_ids":[],"causal_tags":[],"notes_internal":null}]